### ISSUE TITLE
Problem: sempahore hangs on outgoing ssh sessions

### ISSUE THREAD

**Issue by burbilog** [ansible-semaphore/semaphore#2176]
### Issue

Semaphore running simple playbook hangs, often during "Gathering facts":

~~~
---
- name: Get hostname and IP address of all hosts
  hosts: all
  user: root
  gather_facts: yes
  tasks:
    - debug:
        msg: "{{ ansible_all_ipv4_addresses }}"
~~~

~~~
TASK [Gathering Facts] *********************************************************
~~~

And nothing is below this line. If I click -vvv flag, it shows ssh command and then nothing. The most interesting thing that connection DOES happen. Below is tcpdump output from x.x.8.1:

~~~
16:03:40.494432 IP x.x.0.65.43354 > x.x.1.22: Flags [S], seq 2177938587, win 64240, options [mss 1358,sackOK,TS val 3628105968 ecr 0,nop,wscale 7], length 0
16:03:40.494555 IP x.x.1.22 > x.x.0.65.43354: Flags [S.], seq 3347116482, ack 2177938588, win 65160, options [mss 1460,sackOK,TS val 1207537203 ecr 3628105968,nop,wscale 7], length 0
16:03:40.499636 IP x.x.0.65.43354 > x.x.1.22: Flags [.], ack 1, win 502, options [nop,nop,TS val 3628105974 ecr 1207537203], length 0
16:03:40.499745 IP x.x.0.65.43354 > x.x.1.22: Flags [P.], seq 1:22, ack 1, win 502, options [nop,nop,TS val 3628105974 ecr 1207537203], length 21: SSH: SSH-2.0-OpenSSH_9.6
16:03:40.499793 IP x.x.1.22 > x.x.0.65.43354: Flags [.], ack 22, win 509, options [nop,nop,TS val 1207537208 ecr 3628105974], length 0
16:03:40.518887 IP x.x.1.22 > x.x.0.65.43354: Flags [P.], seq 1:41, ack 22, win 509, options [nop,nop,TS val 1207537227 ecr 3628105974], length 40: SSH: SSH-2.0-OpenSSH_8.4p1 Debian-5+deb11u3
16:03:40.523236 IP x.x.0.65.43354 > x.x.1.22: Flags [.], ack 41, win 502, options [nop,nop,TS val 3628105998 ecr 1207537227], length 0
16:03:40.523295 IP x.x.1.22 > x.x.0.65.43354: Flags [P.], seq 41:1121, ack 22, win 509, options [nop,nop,TS val 1207537232 ecr 3628105998], length 1080
16:03:40.523762 IP x.x.0.65.43354 > x.x.8.1.22: Flags [P.], seq 1368:1558, ack 41, win 502, options [nop,nop,TS val 3628105998 ecr 1207537227], length 190
16:03:40.523782 IP x.x.1.22 > x.x.0.65.43354: Flags [.], ack 22, win 509, options [nop,nop,TS val 1207537232 ecr 3628105998,nop,nop,sack 1 {1368:1558}], length 0
16:03:40.523806 IP x.x.0.65.43354 > x.x.1.22: Flags [.], seq 22:1368, ack 41, win 502, options [nop,nop,TS val 3628105998 ecr 1207537227], length 1346
16:03:40.523831 IP x.x.1.22 > x.x.0.65.43354: Flags [.], ack 1558, win 501, options [nop,nop,TS val 1207537232 ecr 3628105998], length 0
16:03:40.529986 IP x.x.0.65.43354 > x.x.1.22: Flags [P.], seq 1558:1606, ack 1121, win 501, options [nop,nop,TS val 3628106004 ecr 1207537232], length 48
16:03:40.538401 IP x.x.1.22 > x.x.0.65.43354: Flags [P.], seq 1121:1605, ack 1606, win 501, options [nop,nop,TS val 1207537247 ecr 3628106004], length 484
16:03:40.588310 IP x.x.0.65.43354 > x.x.1.22: Flags [.], ack 1605, win 501, options [nop,nop,TS val 3628106063 ecr 1207537247], length 0
16:05:40.519691 IP x.x.1.22 > x.x.0.65.43354: Flags [F.], seq 1605, ack 1606, win 501, options [nop,nop,TS val 1207657228 ecr 3628106063], length 0
16:05:40.568454 IP x.x.0.65.43354 > x.x.1.22: Flags [.], ack 1606, win 501, options [nop,nop,TS val 3628226043 ecr 1207657228], length 0
~~~

And that's it, no packets after that. I.e. it DOES connect to ssh port, but nothing else. BTW, journalctl -u ssh -f on remote machine gives nothing except this:

~~~
Connection closed by x.x.0.65 port 32786 [preauth]
~~~

Below is my docker-compose.yaml:

~~~
services:
  # uncomment this section and comment out the mysql section to use postgres instead of mysql
  postgres:
    restart: unless-stopped
    image: postgres:15
    hostname: postgres
    volumes:
      - semaphore-postgres:/var/lib/postgresql/data
    environment:
      POSTGRES_USER: semaphore
      POSTGRES_PASSWORD: xxx
      POSTGRES_DB: semaphore
  semaphore:
    restart: unless-stopped
    ports:
      - 3000:3000
    image: semaphoreui/semaphore:latest
    environment:
      SEMAPHORE_DB_USER: semaphore
      SEMAPHORE_DB_PASS: xxx
      SEMAPHORE_DB_HOST: postgres # for postgres, change to: postgres
      SEMAPHORE_DB_PORT: 5432 # change to 5432 for postgres
      SEMAPHORE_DB_DIALECT: postgres # for postgres, change to: postgres
      SEMAPHORE_DB: semaphore
      SEMAPHORE_PLAYBOOK_PATH: /tmp/semaphore/
      SEMAPHORE_ADMIN_PASSWORD: xxx
      SEMAPHORE_ADMIN_NAME: rm
      SEMAPHORE_ADMIN_EMAIL: rm@xxx.ru
      SEMAPHORE_ADMIN: rm
      SEMAPHORE_ACCESS_KEY_ENCRYPTION: yyy
      TZ: Europe/Berlin
    depends_on:
      - postgres # for postgres, change to: postgres
    volumes:
      - /home/rm/semaphore/requirements.txt:/etc/semaphore/requirements.txt
volumes:
  semaphore-postgres: # to use postgres, switch to: semaphore-postgres
~~~

But no matter how I run semaphore, it sometimes works and sometimes does not. Now I installed semaphore from deb package and it behaves the same. BTW, at first it worked on short playbook that only prints a message and I thought it's a problem of docker version, but no, it hungs too now. Note, then when it connects, sometimes it outputs *part* of facts, not all of them, stopping in the middle of fact dumping if I use  var: ansible_facts to print  all facts.

On the same machine, if i run ansible manually, there no problem -- ansible in shell fetches data quickly and prints whole bunch of facts almost immediately.

It looks very much like PMTU issue, but there is no PMTU issue because I can run this playbook from command line on this server and I can transfer large files over ssh to/from target machines in inventory. Also, if it dumps facts that are already gathered and hangs on the outuput, it's not network issue at all.

It just happens -- sometimes works, sometimes does not. Sometimes I click and it passes gathering facts, but hangs before printing the output -- below is the last output AFTER Gathering facts:

~~~
 5:03:20 PM ok: [x.x.0.65]
~~~

OS is latest Debian:
~~~
(venv) KVM ans pts/1%cat /etc/os-release
PRETTY_NAME="Debian GNU/Linux 12 (bookworm)"
NAME="Debian GNU/Linux"
VERSION_ID="12"
VERSION="12 (bookworm)"
VERSION_CODENAME=bookworm
ID=debian
HOME_URL="https://www.debian.org/"
SUPPORT_URL="https://www.debian.org/support"
BUG_REPORT_URL="https://bugs.debian.org/"
~~~

I tried different versions of docker images, latest, 2.10.7, 2.9.112. All the same...

### Impact

Service (scheduled tasks, alerts)

### Installation method

Docker

### Database

MySQL, BoltDB, Postgres

### Semaphore Version

latest, 2.10.7, 2.9.112

### Manual installation - system information

Linux ans 6.1.0-20-amd64 #1 SMP PREEMPT_DYNAMIC Debian 6.1.85-1 (2024-04-11) x86_64 GNU/Linux
root logged on pts/2 from xxx at 5:10PM.

**Comment by hmoffatt** [comment]
Is this like https://github.com/semaphoreui/semaphore/issues/1513 ?

**Comment by danstis** [comment]
I had a similar issue, for me it was due to the host keys not being known. I resolved it by adding the following to my docker compose file as an environment variable:
```yaml
ANSIBLE_HOST_KEY_CHECKING=False
```

**Comment by bence42** [comment]
There should be a warning about this, or the interactive messages should be visible in the UI. Wasted a day on the same problem.

**Comment by pascaliske** [comment]
> I had a similar issue, for me it was due to the host keys not being known. I resolved it by adding the following to my docker compose file as an environment variable:
> 
> ```yaml
> ANSIBLE_HOST_KEY_CHECKING=False
> ```

I had this solution working as well. But beware that the latest release (`v2.10.32`) does not forward the environment variables from the running host to the Ansible execution: https://github.com/semaphoreui/semaphore/issues/2464 / https://github.com/semaphoreui/semaphore/commit/f33944e0429f711b24e03600a0c1dab7460b3a2d

**Comment by bence42** [comment]
> > I had a similar issue, for me it was due to the host keys not being known. I resolved it by adding the following to my docker compose file as an environment variable:
> > ```yaml
> > ANSIBLE_HOST_KEY_CHECKING=False
> > ```
> 
> I had this solution working as well. But beware that the latest release (`v2.10.32`) does not forward the environment variables from the running host to the Ansible execution: #2464 / [f33944e](https://github.com/semaphoreui/semaphore/commit/f33944e0429f711b24e03600a0c1dab7460b3a2d)


for anyone who's facing a hanging ui at Gathering Facts, here's how to pass the env var in the docker-compose file now:
```yaml
 environment:
      - ANSIBLE_HOST_KEY_CHECKING=False
      - SEMAPHORE_FORWARDED_ENV_VARS=["ANSIBLE_HOST_KEY_CHECKING"]
```
